CATEGORY_CD|CATEGORY_NM|API_PATH|PARENT_CD|DEPTH_LEVEL|LAST_DEPTH_YN|COLLECTION_CYCLE|COLLECTION_TYPE
02000000000000|S&P Global(IHS)(GTAS)|||01|N||
02010000000000|Airborne Metric Tons||02000000000000|02|N||
02010100000000|Animal Products||02010000000000|03|N||
02010101000000|Animal originated products||02010100000000|04|Y|Y,M|C
02010102000000|Aquatic invertebrates, other||02010100000000|04|Y|Y,M|C
02010103000000|Beef, fresh or chilled||02010100000000|04|Y|Y,M|C
02010104000000|Beef, frozen||02010100000000|04|Y|Y,M|C
02010105000000|Birds' eggs||02010100000000|04|Y|Y,M|C
02010106000000|Butter and cheese||02010100000000|04|Y|Y,M|C
02010107000000|Crustaceans, frozen||02010100000000|04|Y|Y,M|C
02010108000000|Crustaceans, live fresh or chilled||02010100000000|04|Y|Y,M|C
02010109000000|Crustaceans, n.e.s., fresh, chilled or frozen||02010100000000|04|Y|Y,M|C
02010110000000|Dairy produce; birds' eggs; natural honey; edible products of animal origin, n.e.s.||02010100000000|04|Y|Y,M|C
02010111000000|Edible offal of bovine animals, swine, sheep, goats, horses etc., fresh or chilled||02010100000000|04|Y|Y,M|C
02010112000000|Edible offal of bovine animals, swine, sheep, goats, horses etc., frozen||02010100000000|04|Y|Y,M|C
02010113000000|Fish and crustaceans, molluscs and other aquatic invertebrates, n.e.s.||02010100000000|04|Y|Y,M|C
02010114000000|Fish and seafood, prepared or preserved||02010100000000|04|Y|Y,M|C
02010115000000|Fish fillets and other fish meat (whether or not minced), fresh or chilled||02010100000000|04|Y|Y,M|C
02010116000000|Fish fillets and other fish meat (whether or not minced), frozen||02010100000000|04|Y|Y,M|C
02010117000000|Fish fillets and other fish meat (whether or not minced), n.e.s., fresh, chilled or frozen||02010100000000|04|Y|Y,M|C
02010118000000|Fish, dried, salted, smoked or in brine and fish meal fit for human consumption||02010100000000|04|Y|Y,M|C
02010119000000|Fish, fresh or chilled, excluding fish fillets and other fish meat without bones||02010100000000|04|Y|Y,M|C
02010120000000|Fish, frozen, excl. fish fillets or fish meat without bones||02010100000000|04|Y|Y,M|C
02010200000000|Beverages and Oils||02010000000000|03|N||
02010201000000|Animal and vegetable oils, excl. soybean oil||02010200000000|04|Y|Y,M|C
02010202000000|Beer, cider, fermented beverages||02010200000000|04|Y|Y,M|C
02010203000000|Beverages, spirits and vinegar, n.e.s.||02010200000000|04|Y|Y,M|C
02010204000000|Grape alcoholic beverages, incl. wine||02010200000000|04|N||
02010204010000|2204 Wine of fresh grapes, including fortified wines; grape must (having an alcoholic strength by volume exceeding 0.5% vol.) nesoi||02010204000000|05|Y|Y,M|C
02010204020000|2205 Vermouth and other wine of fresh grapes flavored with plants or aromatic substances||02010204000000|05|Y|Y,M|C
02010205000000|Palm, coconut and palm kernel oil||02010200000000|04|Y|Y,M|C
02010206000000|Soybean oil||02010200000000|04|Y|Y,M|C
02010207000000|Spirits, liqueurs and other spirituous beverages||02010200000000|04|N||
02010207010000|2207 Ethyl alcohol, undenatured, of an alcoholic strength by volume of 80% vol. or higher; ethyl alcohol and other spirits, denatured, of any strength||02010207000000|05|Y|Y,M|C
02010207020000|2208 Ethyl alcohol, undenatured, of an alcoholic strength by volume of under 80% vol.; spirits, liqueurs and other spirituous beverages||02010207000000|05|Y|Y,M|C
02010208000000|Water, mineral and aerated water||02010200000000|04|N||
02010208010000|2201 Waters, including natural or artificial mineral waters and aerated waters, not containing added sweetening nor flavored; ice and snow||02010208000000|05|Y|Y,M|C
02010208020000|2202 Waters, including mineral waters and aerated waters, containing added sweetening or flavored, and other nonalcoholic beverages nesoi||02010208000000|05|Y|Y,M|C
02010300000000|Chemicals and Related Products||02010000000000|03|N||
02010301000000|Antibiotics||02010300000000|04|Y|Y,M|C
02010302000000|Chemical elements||02010300000000|04|Y|Y,M|C
02010303000000|Chemical products||02010300000000|04|Y|Y,M|C
02010304000000|Dental hygiene, hair, and shaving preparations||02010300000000|04|Y|Y,M|C
02010305000000|Essential oils, perfumes, and beauty preparations||02010300000000|04|Y|Y,M|C
02010306000000|Fertilizers||02010300000000|04|N||
02010306010000|3100 Fertilizers, n.e.s.||02010306000000|05|Y|Y,M|C
02010306020000|3101 Animal or vegetable fertilizers, including mixed or chemically treated; fertilizers made by mixing or chemically treating animal or vegetable products||02010306000000|05|Y|Y,M|C
02010306030000|3102 Mineral or chemical fertilizers, nitrogenous||02010306000000|05|Y|Y,M|C
02010306040000|3103 Mineral or chemical fertilizers, phosphatic||02010306000000|05|Y|Y,M|C
02010306050000|3104 Mineral or chemical fertilizers, potassic||02010306000000|05|Y|Y,M|C
02010306060000|3105 Mineral or chemical fertilizers with two of the three fertilizer elements; fertilizers nesoi; fertilizers in packs etc. not over 10 kg gross weight||02010306000000|05|Y|Y,M|C
02010307000000|Inorganic chemical compounds||02010300000000|04|Y|Y,M|C
02010308000000|Insecticides, rodenticides, fungicides, herbicides, antisprouting products||02010300000000|04|Y|Y,M|C
02010309000000|Man-made staple fibres, n.e.s.||02010300000000|04|Y|Y,M|C
02010310000000|Natural gums, lac, resins||02010300000000|04|Y|Y,M|C
02010311000000|Natural rubber||02010300000000|04|Y|Y,M|C
02010312000000|Organic chemicals||02010300000000|04|Y|Y,M|C
02010313000000|Paint, varnishes, lacquers and inks||02010300000000|04|Y|Y,M|C
02010314000000|Pharmaceutical goods||02010300000000|04|Y|Y,M|C
02010315000000|Plastics and articles thereof||02010300000000|04|Y|Y,M|C
02010316000000|Plastics in primary forms||02010300000000|04|Y|Y,M|C
02010317000000|Rubber and articles thereof||02010300000000|04|Y|Y,M|C
02010318000000|Rubber articles; waste and scrap of rubber||02010300000000|04|Y|Y,M|C
02010319000000|Rubber tyres||02010300000000|04|Y|Y,M|C
02010320000000|Soap and detergents||02010300000000|04|Y|Y,M|C
02010321000000|Synthetic and artificial filament tow and staple fibres||02010300000000|04|Y|Y,M|C
02010322000000|Synthetic and artificial filaments||02010300000000|04|Y|Y,M|C
02010323000000|Waxes, polishes and creams, modeling pastes||02010300000000|04|Y|Y,M|C
02010400000000|Computers, Office, Communications, and Professional Equipment||02010000000000|03|N||
02010401000000|Medical instruments, appliances and diagnostic apparatus||02010400000000|04|Y|Y,M|C
02010402000000|Office machines and parts||02010400000000|04|Y|Y,M|C
02010403000000|Optical and measuring equipment, meters and counters||02010400000000|04|Y|Y,M|C
02010404000000|Other communications equipment||02010400000000|04|Y|Y,M|C
02010405000000|Photographic or cinematographic goods||02010400000000|04|Y|Y,M|C
02010406000000|Photographic, photocopying and optical goods||02010400000000|04|Y|Y,M|C
02010407000000|Radio and tv||02010400000000|04|Y|Y,M|C
02010408000000|Telephones, microphones, etc.||02010400000000|04|Y|Y,M|C
02010500000000|Energy and Mining||02010000000000|03|N||
02010501000000|Bitumen and asphalt||02010500000000|04|Y|Y,M|C
02010502000000|Coal and coke||02010500000000|04|Y|Y,M|C
02010503000000|Crude oil||02010500000000|04|Y|Y,M|C
02010504000000|Diamonds, precious stones, pearls, and articles thereof||02010500000000|04|Y|Y,M|C
02010505000000|Iron ores and concentrates||02010500000000|04|Y|Y,M|C
02010506000000|Manganese ores and concentrates||02010500000000|04|Y|Y,M|C
02010507000000|Marble and granite||02010500000000|04|Y|Y,M|C
02010508000000|Mineral fuels, mineral oils and products of their distillation; bituminous substances; mineral waxes, n.e.s.||02010500000000|04|Y|Y,M|C
02010509000000|Mineral tars and petroleum heavy ends, incl. bitumen; petroleum jelly||02010500000000|04|Y|Y,M|C
02010510000000|Natural gas, petroleum gases and gaseous hydrocarbons||02010500000000|04|Y|Y,M|C
02010511000000|Non-ferrous ores and concentrates, excl manganese ores||02010500000000|04|Y|Y,M|C
02010512000000|Ores, slag and ash, n.e.s.||02010500000000|04|Y|Y,M|C
02010513000000|Refined Petroleum Products||02010500000000|04|Y|Y,M|C
02010514000000|Salt, sulphur, earths, plastering materials, lime and cement||02010500000000|04|Y|Y,M|C
02010515000000|Salt; sulphur; earths, stone; plastering materials, lime and cement||02010500000000|04|Y|Y,M|C
02010516000000|Sands, pebbles, gravel and crushed stone||02010500000000|04|Y|Y,M|C
02010517000000|Slag, dross, ash||02010500000000|04|Y|Y,M|C
02010600000000|Glass and Non-Metallic Products||02010000000000|03|N||
02010601000000|Articles of concrete, cement and plaster||02010600000000|04|Y|Y,M|C
02010602000000|Building stone, worked and non-metallic mineral products, n.e.s.||02010600000000|04|Y|Y,M|C
02010603000000|Ceramic products||02010600000000|04|Y|Y,M|C
02010604000000|Glass and glassware||02010600000000|04|Y|Y,M|C
02010700000000|Machinery and Electrical Equipment||02010000000000|03|N||
02010701000000|Agricultural and food machinery||02010700000000|04|Y|Y,M|C
02010702000000|Bearings and gears||02010700000000|04|Y|Y,M|C
02010703000000|Boilers and turbines, excl. aircraft and vehicle engines||02010700000000|04|Y|Y,M|C
02010704000000|Electric engines, generators and transformers||02010700000000|04|Y|Y,M|C
02010705000000|Electric lamps and lighting equipment||02010700000000|04|Y|Y,M|C
02010706000000|Electrical equipment, n.e.s.||02010700000000|04|Y|Y,M|C
02010707000000|Electricity distribution and control apparatus||02010700000000|04|Y|Y,M|C
02010708000000|Electromechanical and pneumatic hand tools||02010700000000|04|Y|Y,M|C
02010709000000|Electronic valves, tubes, semiconductors and other electronic components||02010700000000|04|Y|Y,M|C
02010710000000|Engines and engine parts; incl. aircraft engines||02010700000000|04|Y|Y,M|C
02010711000000|Farm equipment and earth moving machinery||02010700000000|04|Y|Y,M|C
02010712000000|Filtering machinery, air pumps, fans, etc.||02010700000000|04|Y|Y,M|C
02010713000000|General industrial machinery, n.e.s.||02010700000000|04|Y|Y,M|C
02010714000000|Heating and cooling equipment||02010700000000|04|Y|Y,M|C
02010715000000|Household appliances||02010700000000|04|Y|Y,M|C
02010716000000|Industrial ovens, furnaces and furnace burners; non-electric||02010700000000|04|Y|Y,M|C
02010717000000|Insulated wire and cable; accumulators and batteries; battery waste||02010700000000|04|Y|Y,M|C
02010718000000|Liquid pumps||02010700000000|04|Y|Y,M|C
02010719000000|Machine tools and parts||02010700000000|04|Y|Y,M|C
02010720000000|Machinery and equipment for mining and construction, n.e.s.||02010700000000|04|Y|Y,M|C
02010721000000|Machinery for pulp, paper and printing industries||02010700000000|04|Y|Y,M|C
02010722000000|Metallurgical machinery and equipment||02010700000000|04|Y|Y,M|C
02010723000000|Refrigerators and dishwashing machines, household-type||02010700000000|04|Y|Y,M|C
02010724000000|Special industrial machinery, n.e.s.||02010700000000|04|Y|Y,M|C
02010725000000|Tools, implements, cutlery, spoons and forks, of base metal; parts thereof, of base metal||02010700000000|04|Y|Y,M|C
02010726000000|Washing machines, laundry equipment, textile cleaning||02010700000000|04|Y|Y,M|C
02010800000000|Metals and Metal Products||02010000000000|03|N||
02010801000000|Albuminoidal substances; modified starches; glues; enzymes||02010800000000|04|Y|Y,M|C
02010802000000|Aluminium and articles thereof||02010800000000|04|Y|Y,M|C
02010803000000|Aluminium structures, tanks and containers||02010800000000|04|Y|Y,M|C
02010804000000|Aluminium waste and scrap||02010800000000|04|Y|Y,M|C
02010805000000|Basic iron and steel||02010800000000|04|Y|Y,M|C
02010806000000|Copper and articles thereof||02010800000000|04|Y|Y,M|C
02010807000000|Copper waste and scrap||02010800000000|04|Y|Y,M|C
02010808000000|Ferrous waste and scrap||02010800000000|04|Y|Y,M|C
02010809000000|Flat-rolled products of iron and steel||02010800000000|04|Y|Y,M|C
02010810000000|Iron and steel articles||02010800000000|04|Y|Y,M|C
02010811000000|Iron and steel structures, reservoirs, and tanks||02010800000000|04|Y|Y,M|C
02010812000000|Iron and steel, n.e.s.||02010800000000|04|Y|Y,M|C
02010813000000|Lead and articles thereof||02010800000000|04|Y|Y,M|C
02010814000000|Lead waste and scrap||02010800000000|04|Y|Y,M|C
02010815000000|Metal products; misc base metal products||02010800000000|04|Y|Y,M|C
02010816000000|Nickel and articles thereof||02010800000000|04|Y|Y,M|C
02010817000000|Nickel waste and scrap||02010800000000|04|Y|Y,M|C
02010818000000|Other non-ferrous metals and articles thereof||02010800000000|04|Y|Y,M|C
02010819000000|Precious metals||02010800000000|04|Y|Y,M|C
02010820000000|Tin and articles thereof||02010800000000|04|Y|Y,M|C
02010821000000|Tin waste and scrap||02010800000000|04|Y|Y,M|C
02010822000000|Zinc and articles thereof||02010800000000|04|Y|Y,M|C
02010823000000|Zinc waste and scrap||02010800000000|04|Y|Y,M|C
02010900000000|Miscellaneous||02010000000000|03|N||
02010901000000|Arms and ammunition; parts and accessories thereof||02010900000000|04|Y|Y,M|C
02010902000000|Baby carriages, strollers and carriages for disabled persons||02010900000000|04|Y|Y,M|C
02010903000000|Cigarettes and cigars||02010900000000|04|Y|Y,M|C
02010904000000|Coins||02010900000000|04|Y|Y,M|C
02010905000000|Containers||02010900000000|04|Y|Y,M|C
02010906000000|Explosives; pyrotechnic products; matches; pyrophoric alloys; certain combustible preparations||02010900000000|04|Y|Y,M|C
02010907000000|Feathers and down, prepared; and articles made of feather or of down; artificial flowers; articles of human hair||02010900000000|04|Y|Y,M|C
02010908000000|Furniture, incl. mattress supports and articles of bedding; prefabricated buildings||02010900000000|04|Y|Y,M|C
02010909000000|Goods not classified by kind||02010900000000|04|Y|Y,M|C
02010910000000|Jewelry and precious metal articles||02010900000000|04|Y|Y,M|C
02010911000000|Manufactures of straw, esparto or other plaiting materials; basketware and wickerwork||02010900000000|04|Y|Y,M|C
02010912000000|Miscellaneous manufactured articles||02010900000000|04|Y|Y,M|C
02010913000000|Musical instruments; parts and accessories of such articles||02010900000000|04|Y|Y,M|C
02010914000000|Parachutes||02010900000000|04|Y|Y,M|C
02010915000000|Tanks and other armored fighting vehicles||02010900000000|04|Y|Y,M|C
02010916000000|Toys, games and sports requisites; parts and accessories thereof||02010900000000|04|Y|Y,M|C
02010917000000|Umbrellas, sun umbrellas, walking-sticks, seat sticks, whips, riding crops; and parts thereof||02010900000000|04|Y|Y,M|C
02010918000000|Watches and clocks||02010900000000|04|Y|Y,M|C
02010919000000|Works of art; collectors' pieces and antiques||02010900000000|04|Y|Y,M|C
02011000000000|Textiles, Leather, and Apparel||02010000000000|03|N||
02011001000000|Apparel and clothing accessories; knitted or crocheted||02011000000000|04|Y|Y,M|C
02011002000000|Apparel and clothing accessories; not knitted or crocheted||02011000000000|04|Y|Y,M|C
02011003000000|Articles of leather||02011000000000|04|Y|Y,M|C
02011004000000|Carpets and other textile floor coverings||02011000000000|04|Y|Y,M|C
02011005000000|Fabrics; knitted or crocheted||02011000000000|04|Y|Y,M|C
02011006000000|Footwear; gaiters and the like; parts of such articles||02011000000000|04|Y|Y,M|C
02011007000000|Furskins and artificial fur; manufactures thereof||02011000000000|04|Y|Y,M|C
02011008000000|Headgear and parts thereof||02011000000000|04|Y|Y,M|C
02011009000000|Household linens, blankets, curtains and pillows||02011000000000|04|Y|Y,M|C
02011010000000|Leather, raw hides and skins||02011000000000|04|Y|Y,M|C
02011011000000|Raw silk, silkworm cocoons and silk waste||02011000000000|04|Y|Y,M|C
02011012000000|Silk yarn||02011000000000|04|Y|Y,M|C
02011013000000|Special woven fabrics and other fabrics||02011000000000|04|Y|Y,M|C
02011014000000|Textile fabrics, impregnated or laminated; suitable for industrial use||02011000000000|04|Y|Y,M|C
02011015000000|Textiles, made up articles; sets; worn clothing and worn textile articles; rags||02011000000000|04|Y|Y,M|C
02011016000000|Wadding, felt and nonwovens, special yarns; twine, cordage, ropes and cables||02011000000000|04|Y|Y,M|C
02011017000000|Wool, fine or coarse animal hair; horsehair yarn and woven fabric||02011000000000|04|Y|Y,M|C
02011018000000|Worn clothing and cloth waste||02011000000000|04|Y|Y,M|C
02011019000000|Woven fabrics of cotton||02011000000000|04|Y|Y,M|C
02011020000000|Woven fabrics of flax, jute and vegetable textile fibres||02011000000000|04|Y|Y,M|C
02011021000000|Woven fabrics of silk and silk waste||02011000000000|04|Y|Y,M|C
02011022000000|Woven fabrics of synthetic and artificial filament yarn||02011000000000|04|Y|Y,M|C
02011023000000|Woven fabrics of synthetic staple fibres||02011000000000|04|Y|Y,M|C
02011024000000|Woven fabrics of wool and animal hair||02011000000000|04|Y|Y,M|C
02011025000000|Yarn of flax, jute and vegetable textile fibres||02011000000000|04|Y|Y,M|C
02011026000000|Yarn of manmade filaments||02011000000000|04|Y|Y,M|C
02011027000000|Yarn of manmade staple fibres||02011000000000|04|Y|Y,M|C
02011028000000|Yarn of wool and animal hair||02011000000000|04|Y|Y,M|C
02011100000000|Transportation Equipment and Parts||02010000000000|03|N||
02011101000000|Aircraft and parts||02011100000000|04|Y|Y,M|C
02011102000000|Locomotives and other self-propelled railroad equipment||02011100000000|04|Y|Y,M|C
02011103000000|Motor vehicle parts||02011100000000|04|Y|Y,M|C
02011104000000|Motor vehicles, tractors and works trucks||02011100000000|04|N||
02011104010000|8700 Vehicles; other than railway or tramway rolling stock, and parts and accessories thereof, n.e.s.||02011104000000|05|Y|Y,M|C
02011104020000|8701 Tractors (other than works trucks of heading 8709)||02011104000000|05|Y|Y,M|C
02011104030000|8702 Motor vehicles for the transport of ten or more persons, including the driver||02011104000000|05|Y|Y,M|C
02011104040000|8703 Motor cars and other motor vehicles designed to transport people (other than public-transport type), including station wagons and racing cars||02011104000000|05|Y|Y,M|C
02011104050000|8704 Motor vehicles for the transport of goods||02011104000000|05|Y|Y,M|C
02011104060000|8705 Special purpose motor vehicles, nesoi, including wreckers, mobile cranes, fire fighting vehicles, concrete mixers, mobile workshops, etc.||02011104000000|05|Y|Y,M|C
02011104070000|8706 Chassis fitted with engines for tractors, motor vehicles for passengers, goods transport vehicles and special purpose motor vehicles||02011104000000|05|Y|Y,M|C
02011104080000|8709 Works trucks, self-propelled, not fitted with lifting or handling equipment; tractors used on railway station platforms; parts thereof||02011104000000|05|Y|Y,M|C
02011105000000|Motorcycles, bicycles and parts thereof||02011100000000|04|Y|Y,M|C
02011106000000|Railroad equipment, not self-propelled and parts||02011100000000|04|Y|Y,M|C
02011107000000|Railway, tramway locomotives, rolling-stock and parts thereof; railway or tramway track fixtures and fittings and parts thereof; mechanical (including electro-mechanical) traffic signalling equipment of all kinds, n.e.s.||02011100000000|04|Y|Y,M|C
02011108000000|Shipbuilding and repairing||02011100000000|04|Y|Y,M|C
02011109000000|Trailers and semi-trailers; other vehicles, not mechanically propelled; and parts thereof||02011100000000|04|Y|Y,M|C
02011200000000|Vegetable Products||02010000000000|03|N||
02011201000000|Apples, pears, apricots, cherries, peaches and plums||02011200000000|04|Y|Y,M|C
02011202000000|Bananas||02011200000000|04|Y|Y,M|C
02011203000000|Cane and beet sugar, molasses||02011200000000|04|Y|Y,M|C
02011204000000|Cauliflower, broccoli, cabbages and lettuce, fresh or chilled||02011200000000|04|N||
02011204010000|0704 Cabbages, cauliflower, kohlrabi, kale and similar edible brassicas, fresh or chilled||02011204000000|05|Y|Y,M|C
02011204020000|0705 Lettuce (lactuca sativa) and chicory (cichorium spp.), fresh or chilled||02011204000000|05|Y|Y,M|C
02011205000000|Citrus fruit||02011200000000|04|Y|Y,M|C
02011206000000|Cocoa and cocoa preparations||02011200000000|04|Y|Y,M|C
02011207000000|Coffee||02011200000000|04|Y|Y,M|C
02011208000000|Coffee, tea, maté and spices, n.e.s.||02011200000000|04|Y|Y,M|C
02011209000000|Corn||02011200000000|04|Y|Y,M|C
02011210000000|Cotton and cotton waste||02011200000000|04|Y|Y,M|C
02011211000000|Cotton yarn||02011200000000|04|Y|Y,M|C
02011212000000|Cut flowers and buds, foliage, branches, grasses etc||02011200000000|04|Y|Y,M|C
02011213000000|Dates, figs, pineapples, avocados, guavas, mangoes and mangosteens||02011200000000|04|Y|Y,M|C
02011214000000|Food industry residues and wastes||02011200000000|04|Y|Y,M|C
02011215000000|Food preparations of flour, meal, pasta, bread etc||02011200000000|04|Y|Y,M|C
02011216000000|Food preparations, yeasts, sauces, soups and extracts||02011200000000|04|Y|Y,M|C
02011217000000|Fruits and nuts, frozen||02011200000000|04|Y|Y,M|C
02011218000000|Fruits, dried||02011200000000|04|Y|Y,M|C
02011219000000|Grapes||02011200000000|04|Y|Y,M|C
02011220000000|Industrial or medicinal plants; straw and fodder||02011200000000|04|Y|Y,M|C
02011221000000|Jams, jellies, marmalades and fruit purees||02011200000000|04|Y|Y,M|C
02011222000000|Leguminous and other vegetables, dried||02011200000000|04|Y|Y,M|C
02011223000000|Live plants, bulbs, tubers etc||02011200000000|04|Y|Y,M|C
02011224000000|Melons (including watermelons) and papayas (papaws)||02011200000000|04|Y|Y,M|C
02011225000000|Natural honey||02011200000000|04|Y|Y,M|C
02011226000000|Nuts, fresh or dried||02011200000000|04|Y|Y,M|C
02011227000000|Oil seeds and oleaginous fruits||02011200000000|04|Y|Y,M|C
02011228000000|Onions, garlic, leeks, leguminous vegetables, other vegetables, fresh and chilled||02011200000000|04|Y|Y,M|C
02011229000000|Other fresh fruits||02011200000000|04|Y|Y,M|C
02011230000000|Other grains and cereals, incl. rye, barley, oats||02011200000000|04|N||
02011230010000|1000 Cereals, n.e.s.||02011230000000|05|Y|Y,M|C
02011230020000|1002 Rye||02011230000000|05|Y|Y,M|C
02011230030000|1003 Barley||02011230000000|05|Y|Y,M|C
02011230040000|1004 Oats||02011230000000|05|Y|Y,M|C
02011231000000|Pepper, vanilla, other spices, incl ginger, saffron, turmeric etc||02011200000000|04|Y|Y,M|C
02011232000000|Potatoes, carrots, beets and radishes, fresh or chilled||02011200000000|04|N||
02011232010000|0701 Potatoes (other than sweet potatoes), fresh or chilled||02011232000000|05|Y|Y,M|C
02011232020000|0706 Carrots, turnips, salad beets, salsify, radishes and similar edible roots, fresh or chilled||02011232000000|05|Y|Y,M|C
02011233000000|Preparations of vegetables, fruit, nuts or other parts of plants||02011200000000|04|Y|Y,M|C
02011234000000|Rice||02011200000000|04|Y|Y,M|C
02011235000000|Seeds, fruits and spores for sowing||02011200000000|04|Y|Y,M|C
02011236000000|Soybeans||02011200000000|04|Y|Y,M|C
02011237000000|Sugar confectionery||02011200000000|04|Y|Y,M|C
02011238000000|Sunflower seeds, rapeseed and colza seeds||02011200000000|04|Y|Y,M|C
02011239000000|Tea||02011200000000|04|Y|Y,M|C
02011240000000|Tobacco and tobacco refuse||02011200000000|04|Y|Y,M|C
02011241000000|Tomatoes, cucumbers and gherkins, fresh and chilled||02011200000000|04|N||
02011241010000|0702 Tomatoes, fresh or chilled||02011241000000|05|Y|Y,M|C
02011241020000|0707 Cucumbers and gherkins, fresh or chilled||02011241000000|05|Y|Y,M|C
02011242000000|Vegetable plaiting materials; vegetable products not elsewhere specified or included||02011200000000|04|Y|Y,M|C
02011243000000|Vegetable textile fibres; paper yarn and woven fabrics of paper yarn||02011200000000|04|Y|Y,M|C
02011244000000|Vegetables and certain roots and tubers; edible, n.e.s.||02011200000000|04|Y|Y,M|C
02011245000000|Vegetables, frozen||02011200000000|04|Y|Y,M|C
02011246000000|Vinegar||02011200000000|04|Y|Y,M|C
02011247000000|Wheat||02011200000000|04|Y|Y,M|C
02011248000000|Wheat and cereal flour, products and malt||02011200000000|04|Y|Y,M|C
02011300000000|Wood, Paper and Related Products||02010000000000|03|N||
02011301000000|Books, periodicals, and maps||02011300000000|04|Y|Y,M|C
02011302000000|Builders' joinery and carpentry of wood; wooden containers||02011300000000|04|Y|Y,M|C
02011303000000|Natural cork, incl. articles of cork, waste cork and crushed or ground cork||02011300000000|04|Y|Y,M|C
02011304000000|Newsprint and uncoated paper and paperboard excl. printing paper||02011300000000|04|Y|Y,M|C
02011305000000|Other paper and paperboard||02011300000000|04|Y|Y,M|C
02011306000000|Other wood products, n.e.s.||02011300000000|04|Y|Y,M|C
02011307000000|Paper and paperboard packing and other articles||02011300000000|04|Y|Y,M|C
02011308000000|Paper and paperboard; articles of paper pulp, of paper or paperboard, n.e.s.||02011300000000|04|Y|Y,M|C
02011309000000|Paper stationery excl. printing paper||02011300000000|04|Y|Y,M|C
02011310000000|Postcards, calendars, and other printed materials||02011300000000|04|Y|Y,M|C
02011311000000|Printing and writing paper||02011300000000|04|Y|Y,M|C
02011312000000|Pulp||02011300000000|04|Y|Y,M|C
02011313000000|Veneer, plywood, particle board, etc.||02011300000000|04|Y|Y,M|C
02011314000000|Waste and scrap of paper or paperboard||02011300000000|04|Y|Y,M|C
02011315000000|Wood charcoal||02011300000000|04|Y|Y,M|C
02011316000000|Wood sleepers for railway and tramways||02011300000000|04|Y|Y,M|C
02011317000000|Wood, incl. fuel wood||02011300000000|04|Y|Y,M|C